2005-05-15T09:41:00.000Z	hybrid_goth		in dos a * is a wildcard what is a wildcard in unix
2005-05-15T09:41:00.000Z	hybrid_goth		ok ty
2005-05-15T09:41:00.000Z	Nalioth	hybrid_goth	* is a general wildcard and ? is a specific-character wildcard
2005-05-15T10:06:00.000Z	Nalioth	hybrid_goth	no it does now, and i've found on my PPC that it is very fun getting java to work
2005-05-18T07:19:00.000Z	hybrid_goth	Nalioth	you also know ppc is the best :P
2005-05-18T07:19:00.000Z	Nalioth	hybrid_goth	why would you say that?  :P
2005-05-18T07:20:00.000Z	hybrid_goth	Nalioth	no idea...
2005-05-18T07:20:00.000Z	hybrid_goth	Nalioth	amen
2005-05-18T07:20:00.000Z	hybrid_goth	Nalioth	G3 right?
2005-05-18T07:32:00.000Z	Nalioth	hybrid_goth	with big buttons
2005-05-18T07:27:00.000Z	Nalioth	hybrid_goth	this particular chat gateway is a G3 ibook
2005-05-18T07:27:00.000Z	hybrid_goth	Nalioth	my box is a g3
2005-05-18T07:27:00.000Z	Nalioth	hybrid_goth	my new G4 ibook is awaiting drivers for the Aiport Extreme
2005-05-18T07:27:00.000Z	hybrid_goth	Nalioth	I was told that wont _ever_ happen
2005-05-18T07:27:00.000Z	Nalioth	hybrid_goth	may i say, BULL<cookies>!!
2005-05-18T07:28:00.000Z	hybrid_goth	Nalioth	b/c i was going to get a g4 superdrive etc but they said no wifi driver and prolly never
2005-05-18T07:29:00.000Z	hybrid_goth	Nalioth	i wanna get a mac mini deck it out purrrr
2005-05-18T07:29:00.000Z	hybrid_goth	Nalioth	do you know of a linux ppc VoIP?
2005-05-18T07:29:00.000Z	Nalioth	hybrid_goth	so share it off your G3
2005-05-18T07:29:00.000Z	Nalioth	hybrid_goth	my first mac-mini is goin under my driver seat (i drive a taxi) and will be full of music
2005-05-18T07:30:00.000Z	Nalioth	hybrid_goth	can skype not be compiled for PPC?
2005-05-18T07:30:00.000Z	hybrid_goth	Nalioth	nice. Mplayer on there a small display
2005-05-18T07:30:00.000Z	hybrid_goth	Nalioth	nope it can not i tried
2005-05-18T07:30:00.000Z	hybrid_goth	Nalioth	I d/l the source and went to compile and i got errrors
2005-05-18T07:31:00.000Z	Nalioth	hybrid_goth	saw a thang when the mini first came out showing a 5" touch screen
2005-05-18T07:32:00.000Z	hybrid_goth	Nalioth	hmm that would be nice to put in the cab and have like mplayer or vlc
2005-05-18T07:32:00.000Z	Nalioth	hybrid_goth	did you ask uncle google the secret of compiling skype on ppc?
2005-05-18T07:32:00.000Z	Nalioth	hybrid_goth	i just want a full-screen control panel (since i won't be surfing or writing thesis while i drive)
2005-05-18T07:32:00.000Z	Nalioth	hybrid_goth	osx skype works great
2005-05-18T07:33:00.000Z	hybrid_goth	Nalioth	would it work on ppc linux tho
2005-05-18T07:33:00.000Z	Nalioth	hybrid_goth	osx is bsd based, linux is a wee bit different. ask uncle google for the secret
2005-05-18T07:36:00.000Z	hybrid_goth	Nalioth	does the ibook g3 have a mic
2005-05-18T07:37:00.000Z	Nalioth	hybrid_goth	yes it does, and speakers, too
2005-05-18T07:38:00.000Z	hybrid_goth	Nalioth	i knew it had speaker- listen to A Perfect Circle right now- juss idk if it had a mic but cool
2005-05-18T07:38:00.000Z	Nalioth	hybrid_goth	they say when you buy a Mac, you need pay for nothing else...(fw cards, usb cards, etc)
2005-05-18T07:39:00.000Z	Nalioth	hybrid_goth	the mini still comes with fw/usb2
2005-05-18T07:39:00.000Z	Nalioth	hybrid_goth	apple usually puts the mic on the display
2005-05-18T07:40:00.000Z	hybrid_goth	Nalioth	but you got to buy a monitor keyboard and mouse
2005-05-18T07:41:00.000Z	Nalioth	hybrid_goth	the mini costs $499US. you buy it, and throw away your windoze bookend, reusing the perfectly good peripherals that were being sullied by it
2005-05-18T07:41:00.000Z	hybrid_goth	Nalioth	yea but if it is a first computer...
2005-05-18T07:42:00.000Z	Nalioth	hybrid_goth	if it is a first puter, go to walmart
2005-05-18T07:42:00.000Z	hybrid_goth	Nalioth	get a 500$ linspire laptop
2005-05-18T07:43:00.000Z	Nalioth	hybrid_goth	shut yo mouth!
2005-05-18T07:43:00.000Z	hybrid_goth	Nalioth	 rofl
2005-05-18T07:43:00.000Z	hybrid_goth	Nalioth	dont you love linspire
2005-05-18T07:43:00.000Z	hybrid_goth	Nalioth	it can run all you winblows apps ootb
2005-05-18T07:44:00.000Z	Nalioth	hybrid_goth	it is a debian distro
2005-05-18T07:44:00.000Z	Nalioth	hybrid_goth	see above remark concering bulls (00tb, my butt)
2005-05-18T07:44:00.000Z	hybrid_goth	Nalioth	yea with wine built in
2005-05-18T07:45:00.000Z	hybrid_goth	Nalioth	it is like debian for nobody
2005-05-18T07:45:00.000Z	Nalioth	hybrid_goth	i think linspire will be safe from my input
2005-05-18T07:45:00.000Z	hybrid_goth	Nalioth	roflmao
2005-05-18T07:48:00.000Z	Nalioth	hybrid_goth	what dmg?
2005-05-18T07:49:00.000Z	hybrid_goth	Nalioth	the skype dmg
2005-05-18T07:50:00.000Z	Nalioth	hybrid_goth	if you aint gonna run it on OSX, chunk it
2005-05-18T07:51:00.000Z	Nalioth	hybrid_goth	you need the skype sources
2005-05-18T07:52:00.000Z	hybrid_goth	Nalioth	it says skype-i586
2005-05-18T07:57:00.000Z	Nalioth	hybrid_goth	how many trash folders do you have?
2005-05-18T07:58:00.000Z	hybrid_goth	Nalioth	1
2005-05-21T15:54:00.000Z	hybrid_goth	Nalioth	w3m beats gecko and konquor
2005-05-22T09:53:00.000Z	hybrid_goth	Nalioth	rots?
2005-05-22T09:16:00.000Z	hybrid_goth	Nalioth	the ubuntuguide has nice urls
2005-05-22T09:23:00.000Z	Nalioth	hybrid_goth	why does any OS have so many libs?
2005-05-22T09:26:00.000Z	hybrid_goth	Nalioth	i hear you
2005-05-22T10:10:00.000Z	hybrid_goth	Nalioth	the never release a final tho man i was lookin forward to it
2005-05-22T10:10:00.000Z	Nalioth	hybrid_goth	yes, i was waiting for the .tgz to have me an p/u number at the apple store for my hardware PPC emulater  :P
2005-05-22T10:11:00.000Z	hybrid_goth	Nalioth	do you run MOL?
2005-05-22T10:12:00.000Z	Nalioth	hybrid_goth	no i do not
2005-05-22T10:12:00.000Z	hybrid_goth	Nalioth	ah ok
2005-05-22T10:12:00.000Z	Nalioth	hybrid_goth	was really wanting one of those litte 6"x6" emulators at the apple store
2005-05-22T10:12:00.000Z	hybrid_goth	Nalioth	havent heard of those
2005-05-22T10:13:00.000Z	Nalioth	hybrid_goth	come on! the Mac Mini! 6x6x4
2005-05-22T10:13:00.000Z	hybrid_goth	Nalioth	ah hahaha
2005-05-22T10:14:00.000Z	hybrid_goth	Nalioth	Mac Mini with tiger and ubuntu
2005-05-22T10:14:00.000Z	hybrid_goth	Nalioth	never did like os x but i wanna try tiger
2005-05-22T10:14:00.000Z	Nalioth	hybrid_goth	Mac Mini under my taxicab drivers seat full of music
2005-05-22T10:14:00.000Z	hybrid_goth	Nalioth	nice.
2005-05-22T10:17:00.000Z	hybrid_goth	Nalioth	osx/ppc? thats like windows/x86
2005-05-22T10:17:00.000Z	Nalioth	hybrid_goth	his linux isnt on his mac
2005-05-22T10:17:00.000Z	Nalioth	hybrid_goth	knapjack is ssh'd to his linux box
2005-05-22T10:17:00.000Z	hybrid_goth	Nalioth	i know but os x is only ppc
2005-05-22T10:17:00.000Z	hybrid_goth	Nalioth	cool
2005-05-22T10:18:00.000Z	Nalioth	hybrid_goth	if you are tru hardcore, you can get osx onto one of those old-ass motorola 9X cpus
2005-05-22T10:18:00.000Z	hybrid_goth	Nalioth	 would it be worth it tho
2005-05-22T10:19:00.000Z	Nalioth	hybrid_goth	do you drink penguin blood?
2005-05-22T10:19:00.000Z	hybrid_goth	Nalioth	he no i drink Redmond blood and suck the life from them
2005-05-22T10:20:00.000Z	Nalioth	hybrid_goth	eewww
2005-05-22T10:20:00.000Z	hybrid_goth	Nalioth	lol
2005-05-22T10:22:00.000Z	Nalioth	hybrid_goth	redmond blood is lethally toxic stuff
2005-05-22T10:22:00.000Z	hybrid_goth	Nalioth	not if taken with enuff ppc/unix
2005-05-22T10:23:00.000Z	hybrid_goth	Nalioth	see IE percentage is below 90 now
2005-05-22T10:31:00.000Z	hybrid_goth	Nalioth	MS spyware/AV is prolly bigger
2005-05-22T10:32:00.000Z	Nalioth	hybrid_goth	but thats not an installable program
2005-05-22T10:32:00.000Z	Nalioth	hybrid_goth	that is a growing problem (like cancer)
2005-05-22T10:32:00.000Z	hybrid_goth	Nalioth	i meant their Antivirus and Spyware beta searcher w/e
2005-05-22T10:33:00.000Z	Nalioth	hybrid_goth	M$ Antivirus and Spyware? hmmm come here Mr. Fox, and Mr. COyote, I want you to guard my henhouse
2005-05-22T10:34:00.000Z	hybrid_goth	Nalioth	heh
2005-05-22T10:55:00.000Z	hybrid_goth	Nalioth	most of us in here are
